date,user_name,text
2020-05-06,rneelmani,"@Microsoft announced a security challenge that encourages #whitehat #hackers to find and disclose #vulnerabilities in @Azure #AzureSphere - an #IoT #security solution for end-to-end security across hardware, OS and #cloud. ⁦@DynamicCISO #girlswhocode https://www.securityweek.com/microsoft-offering-100000-vulnerabilities-azure-sphere"
2020-05-06,techdesign_com,"#Nuvoton M261/M262/M263 series #microcontrollers target the usage of #IoT devices. These series were designed with low power and robust security that could be used in #SmartHome, #SmartCity, #industrial, and #medical related applications, etc.."
2020-05-06,digital_trans4m,Cross-Modal Leakage - IoT Devices - i-HLS - Israel Homeland Security #IoT #Security CC:@Ronald_vanLoon
2020-05-06,dlearningland,#Discount | $9.99 Offer | Best Cyber Security Certifications http://bit.ly/2JW7GUh #cybersecurity #InfoSec #Security #Ransomware #Firewall #CyberAttack #Malware #IoT #ddos #Discounts #Promotions #Promo #Coupon #Coupons #DiscountCode #Udemy #UdemyCoupon
2020-05-06,AlisterBrenton,"Microsoft to hackers: Break our Azure Sphere Linux IoT OS and earn up to $100k Microsoft puts up a $100,000 bounty for critical bugs affecting its Linux-based OS for Azure Sphere. http://twib.in/l/ELjdppaoBxR5 via @AlisterBrenton #infosec #security "
2020-05-06,Digitaltrans4mF,Quelles leçons tirer du virus ILOVEYOU vingt ans après ? - Global Security Mag #Sécurité #IoT 
2020-05-05,NickJustinian,Learn how #Hauwei #5G networks &amp; technologies pose a #IoT #bigdata security risk thru surveillance for it's end-users and customers. 
2020-05-05,SCStelz,"Our new research challenge aims to spark new high impact security research in Azure Sphere, a comprehensive IoT security solution delivering end to end security across hardware, OS and the cloud. https://lnkd.in/gSyWwG9 #MSFTAdvocate"
2020-05-05,digital_trans4m,Security Experts Give Thoughts on ILOVEYOU Virus 20 Years Later | Avast - Security Boulevard #IoT #Security CC:@Ronald_vanLoon
2020-05-05,digitalkeys,#NBIoT #smartlocks have unprecedented security. #Privacy #BigData #AI #MachineLearning #IoT #5G #security Cc @MarshaCollier @AkwyZ @StephaneNappo @TopCyberNews @digitalcloudgal @jblefevre60 @JBarbosaPR @roxanasoi
2020-05-05,CyberNewsOutlet,"Microsoft Challenges Security Researchers to Hack Azure Sphere Participants can earn up to $100,000 for finding severe flaws in Microsoft's Linux-based Azure Sphere IoT operating system. https://www.darkreading.com/threat-intelligence/microsoft-challenges-security-researchers-to-hack-azure-sphere/d/d-id/1337739?_mc=rss_x_drr_edt_aud_dr_x_x-rss-simple via @DarkReading"
2020-05-05,MSDeviceIoT,"Sign up for the free #MSBuild event as the developer community comes together to learn, connect, and code. Topics covered will include #IoT and the importance of #security, join in from May 19-20 to learn more. #AzureSphere #IoTinActionMS"
2020-05-05,coco_security,"Kaiji, el nombre de un nuevo malware escrito con GO que infecta dispositivos IoT y servirdores de Linux para luego ser usados en ataques DDoS. Se apodera por medio de sesiones en SSH. https://threatpost.com/kaiji-botnet-iot-linux-devices/155463/ via @threatpost"
2020-05-05,Gurgling_MrD,"Kaiji, a new botnet campaign, created from scratch rather than resting on the shoulders of those that went before it, is infecting Linux-based servers and IoT devices with the intention of... via @gcluley #security #tech #WednesdayWisdom"
2020-05-05,z3roTrust,"“Golang is an easier language to program in than C and enables developers to build more code much more easily than to work with C,” Paul Litvak, security researcher with Intezer. New Kaiji Botnet Targets IoT, Linux Devices: https://threatpost.com/kaiji-botnet-iot-linux-devices/155463/ via @threatpost"
2020-05-05,hashtagIoT,Sensors | Free Full-Text | Realizing Efficient Security and Privacy in IoT Networks #InternetOfThings
2020-05-05,KudelskiSec,@Kudelski_IoT's Christopher Schouten joined @iotforall's podcast to discuss the #security challenges in the #IoT landscape. Do yourself a favor and give it a listen. 
2020-05-05,SuriyaSubraman,Kudelski Group's Christopher Schouten | Security Challenges in the IoT Landscape http://dlvr.it/RW4hsX #iot #data #internetofthings
2020-05-05,software4iot,OPTICSPY - A TOOL TO EXPLORE OPTICAL DATA TRANSMISSIONS AND COVERT CHANNELS http://bit.ly/2LIH8Tw #IoTSecurity #ConnectedDevices #DigitalTransformation 3
2020-05-05,RemiAfon,Security researchers spotted a new piece of #DDoS bot dubbed Kaiji that is targeting #IoT devices via SSH #bruteforce attacks.
2020-05-05,iotforall,"""The most simple IoT security measures start with hardware."" Hear more from Christopher Schouten of Kudelski Group in this week's IoT For All Podcast! | #iotmakers #iotsecurity #IoT https://www.iotforall.com/e064-iot-security-considerations/?utm_campaign=coschedule&amp;utm_source=twitter&amp;utm_medium=iotforall&amp;utm_content=Kudelski%20Group%27s%20Christopher%20Schouten%20-%20Security%20Challenges%20in%20the%20IoT%20Landscape"
2020-05-05,DarkReading,Microsoft Challenges Security Researchers to Hack Azure Sphere http://ow.ly/Ww9t50zxYaI #Microsoft #AzureSphere #IoT
2020-05-05,embedthat,IoT Security Checklist V2. https://www.embedthis.com/blog/posts/stories/iot-developer-security-checklist.html #iot #embedded #cybersecurity #263
2020-05-05,RayWitselHA,"Today was a good day! Why, you ask? Because I blocked 10354 ads via Pi-Hole! #PiHole #Security Status:(Offline) #IOT #SmartHome"
2020-05-05,Richard_S81,#Hacking #Botnet #IoT #DDoSAttacks #BruteForceAttacks #Kaiji #Vulnerability #CyberAttack #CyberSecurity Security researchers spotted a new piece of DDoS bot dubbed Kaiji that is targeting IoT devices via SSH brute-force attacks. https://intezer.com/blog/research/kaiji-new-chinese-linux-malware-turning-to-golang/ https://securityaffairs.co/wordpress/102753/malware/kaiji-linux-iot-malware.html
2020-05-05,stangrunner,Kaiji – a new strain of IoT malware seizing control and launching DDoS attacks https://www.bitdefender.com/box/blog/iot-news/kaiji-new-strain-iot-malware-seizing-control-launching-ddos-attacks/ #security #feedly
2020-05-05,MSDeviceIoT,"With the #AzureSphere Security Research Challenge, we challenge thinkers to spark new high impact research with the comprehensive #IoT security solution. Can you deliver end-to-end security across hardware? Apply to this research program. https://msrc-blog.microsoft.com/2020/05/05/azure-sphere-security-research-challenge/ #IoTinActionMS"
2020-05-05,infosecindustry,Kaiji – a new strain of IoT malware seizing control and launching DDoS attacks http://zpr.io/tcjjM #infosec #security
2020-05-05,SimoneKnaap,Six IoT Security Threats to Watch. #technology #IoT https://buff.ly/3aNQ19n
2020-05-05,ajbrown1906,#WFH and #IoT devices make #endpoint security more important than ever. Is your #cybersecurity strategy up to the task? Find out in our latest blog post! https://bit.ly/3fmG6es
2020-05-05,SpywareTweets,"Microsoft Challenges Security Researchers to Hack Azure Sphere. Participants can earn up to $100,000 for finding severe flaws in Microsoft's Linux-based Azure Sphere IoT operating system. #infosec #CyberSecurity"
2020-05-05,Forescout,"IoT or OT, with or without agents, it doesn't matter to us, we'll help you see all your connected devices. Just ask the NHS Fife. http://ow.ly/60FW50ze4AN #OTsecurity #ICS #IoTsecurity "
2020-05-05,SmartHome_insta,Never be worried about your elderly and loved ones while you're away. Complete home monitoring for peace of mind Visit our website for more information http://sma.mercenary-audio.com #smarthome #homeautomation #technology #security #smarthometechnology #iot #losAngeles #Orangecounty
2020-05-05,_asifbhat_,This security patrol robot keeps local streets safe at night. (Startup Selfie) #PublicSafety #Robotics via @jamesvgingerich #ArtificialIntelligence #AI #Robotics #DataScience #MachineLearning #DeepLearning #IoT #DigitalTransformation #PredictiveAnalytics
2020-05-05,shah_sheikh,"Microsoft Challenges Security Researchers to Hack Azure Sphere: Participants can earn up to $100,000 for finding severe flaws in Microsoft's Linux-based Azure Sphere IoT operating system. https://www.darkreading.com/threat-intelligence/microsoft-challenges-security-researchers-to-hack-azure-sphere/d/d-id/1337739?_mc=rss_x_drr_edt_aud_dr_x_x-rss-simple&amp;utm_source=dlvr.it&amp;utm_medium=twitter"
2020-05-05,cipherstorm,"Microsoft Challenges Security Researchers to Hack Azure Sphere: Participants can earn up to $100,000 for finding severe flaws in Microsoft's Linux-based Azure Sphere IoT operating system. https://bit.ly/2W9RgvH"
2020-05-05,jamesvgingerich,Silex' Malware Renders #InternetOfThings Devices Useless. Here's How to Prevent It. (Fortune) #IoT #Security https://buff.ly/2KIo61W
2020-05-05,NodleTeam,Part 2...Blockchain Tales: Becoming Interoperable with Stellar. By @EliottTeiss #bluetooth #connectivity #iot #security #privacy #earnings #Blockchain #network #decentralization #crowdsourcing
2020-05-05,cogtropolis,What advocates for internet privacy can learn from Greta Thunberg https://buff.ly/2WwTDY6 #Internet #Data #privacy #dataprivacy #dataprotection #Online #hacking #cybersecurity #cybercrime #surveillance #monitoring #IoT #IoTSecurity #dataprotection
2020-05-05,AlisterBrenton,New Kaiji malware targets IoT devices via SSH brute-force attacks Researchers say the malware was coded by a Chinese developer for the sole purpose of launching DDoS attacks. http://twib.in/l/68axoGeggjX5 via @AlisterBrenton #infosec #security 
2020-05-05,jessistrashyt,i like to go on shodan from time to time and find people who use the ip webcam app and punish them by turning on circular recording for the highest interval i can and just fucking the settings up people really are blind to how bad IoT is with security
2020-05-05,comsec,"Shadow #IoT Devices A Major Concern For Corporate Networks, Infoblox Research Finds http://dld.bz/hYb39 #security #CISO"
2020-05-05,isantosian,Google #Security! #Memes #math #science #engineering #cybersecurity #artificialintelligence #technology #machinelearning #PHP #C #Python #Java #Javascript #100DaysOfCode #girlswhocode #Analytics #DataScience #IoT #PyTorch #TensorFlow #Linux #Coding #AI #programming #CodeNewbies
2020-05-05,naikrd,New Kaiji malware targets IoT devices via SSH brute-force attacks #InternetOfThings #security via http://twinybots.ch
2020-05-05,digital_trans4m,Cross-Modal Leakage - IoT Devices - i-HLS - Israel Homeland Security #DigitalTransformation #IoT CC:@ruskibeats
2020-05-05,IoTInformer,Kudelski Group's Christopher Schouten | Security Challenges in the IoT Landscape - IoT for all 
2020-05-05,LogZilla,Dependency on digital connectivity is real – do you know what remains vital to grow our connected world? https://bit.ly/34POK0f #Data #Cyber #SupplyChain #AI #DataPrivacy #Breach #Security #WiFi #5G #IoT #IIoT #WiFi6 #BigData
2020-05-05,GoUnifiedTech,Solutionz Cyber offers Cybersecurity Maturity Model Certification or CMMC which is required for organizations who provide goods and services to the federal government. Our team will help move you to success #Solutionzcyber #cybersecurity #CMMC #fedgov #security #avsecurity #IoT 
2020-05-05,SolutionzInc,Solutionz Cyber offers Cybersecurity Maturity Model Certification or CMMC which is required for organizations who provide goods and services to the federal government. Our team will help move you to success #Solutionzcyber #cybersecurity #CMMC #fedgov #security #avsecurity #IoT 
2020-05-05,ARNE_Solutions,"Kaiji, a new Linux malware targets IoT devices in the wild https://securityaffairs.co/wordpress/102753/malware/kaiji-linux-iot-malware.html #security"
2020-05-05,N8IdentityInc,Three Tips to Help CISOs Close the IT-OT Security Gap | http://SecurityWeek.Com https://buff.ly/3a6rSdJ via @SecurityWeek #ciso #iot #it #cybersecurity #networksecurity
2020-05-05,ordrofthings,Our VP Product Strategy Russell Rice answers the top questions about #FIPS 140-2 and what it means. #cybersecurity #iotsecurity #ordr https://buff.ly/3c8aAPb
2020-05-05,jamilahmed_16,"12 Best AWS #Certification Courses, #Training &amp; #Tutorials https://www.jadirectives.com/best-aws-certification-training-online/ #Amazon #awscertified #AWS #AWSdeveloper #Cloud #CloudComputing #Development #eLearning #DevOps #IoT #Tech #Technology #Career #jobs #exam #security #SysOps #IT #Business #Cisco #networking"
2020-05-05,Jason7361,The complexities of healthcare IoT security. #Cybersecurity #IoTSecurity via @HelpNetSecurity https://bit.ly/35tJobg
2020-05-05,JulianSmallman,RT:IBMIoT: IBM and Red Hat launch a set of #edge computing solutions to ensure safety and security at the workplace with insights from the edge using #IoT data from remote workers. Robert Thoss explains how #Maximo Worker Insights supports safety and pea…
2020-05-05,NetOfEverything,What is OWASP? Top 10 Web Application Security Risks | https://ift.tt/3b7YynZ | #iot #internetofthings #cybersecurity #ai
2020-05-05,LongusSecurity,New Kaiji malware targets IoT devices via SSH brute-force attacks #InternetOfThings #security via http://twinybots.ch
2020-05-05,IBMIoT,IBM and Red Hat launch a set of #edge computing solutions to ensure safety and security at the workplace with insights from the edge using #IoT data from remote workers. Robert Thoss explains how #Maximo Worker Insights supports safety and peace of mind. https://ibm.co/2YOqZ7Z
2020-05-05,EntrustDatacard,"Many companies are not currently using encryption technology for IoT devices. But now, with Entrust Datacard available on PTC Marketplace, it’s easier for organizations to adopt IoT security and gain access to IoT data. Read press release here: https://bit.ly/3fxfjMK"
2020-05-05,curiousmindinfo,Top 5 Technologies to learn in 2020 1. AI & ML 2. IoT 3. Data Structures &amp; Algorithms 4. DevOps 5. Cyber Security https://curiousmindinfo.com/technologies-to-learn-in-2020/
2020-05-05,lgomezperu,Some best practices in preparing for #Ransomware and #Phishing attacks from @SearchSecurity #CyberSecurity #DataSecurity #DataProtection #IoTSecurity #Hackers #Malware #CyberCrime
2020-05-05,oneM2M,"#DidYouKnow… From a functional perspective, @oneM2M standards define 14 common services functions to enable network connectivity, device security, #IoT device services and management and much more. Read more in our whitepaper: https://bit.ly/2VnLCpt"
2020-05-05,NetFoundry,Article: NetFoundry addresses key secure access challenges for IoT and remote workers https://www.crn.com/news/internet-of-things/netfoundry-sees-big-iot-remote-it-play-for-zero-trust-networking Via @CRN @DylanJMartin #networking #security #ZeroTrust #NaaS #IoT #IIoT #remoteworking
2020-05-05,pluribusnet,#ICYMI we launched a new networking solution to simplify #IoT video surveillance and security. The Pluribus IoT Video Security Fabric makes deploying and managing networks for #videosurveillance cost-efficient and secure. Learn more!
2020-05-05,GRComputers,"Microsoft launches IoT-focused bounty program with $100K awards - Microsoft announced today the launch of a new IoT-focused research program with awards of up to $100,000 for vulnerabilities found by security researchers in the Azure Sphere IoT security … "
2020-05-05,TheIoT,LED and Buzzer for General Purpose and Security https://alltheinternetofthings.com/entries/650974 #IoT
2020-05-05,SmartHome_insta,Give your home that modern look. hour home lighting designers will help you turn your home into a masterpiece. Visit our website for more information http://sma.mercenary-audio.com #smarthome #homeautomation #technology #security #smarthometechnology #iot #losAngeles #Orangecounty
2020-05-05,iotforall,"#IoT #web #development has unique requirements: 1—The volume of #data requires reliability and scalability. 2—#IoT demands dynamic #UI solutions 3—Since IoT UIs are the weak security link, strong #encryption is a must. #IoTForAll @Eliftech"
2020-05-05,sigmaridge,Dell channel VP Cheryl Cook's life in lockdown https://oal.lu/xGy2m For more info: https://oal.lu/mnOUK #data #security #bigdata #Digitaltransformation #finance #cloud #cybersecurity #CEO #cmo #digital #marketing #microsoft #IOT #internetofthings #dell #cto #business
2020-05-05,nTangledCloud,"SAP Finds Cybersecurity Shortfalls With SuccessFactors, Concur - Bloomberg https://buff.ly/3c8nOf4 #tech #technology #blockchain #innovation #science #IT #BigData #Security #cybersecurity #crypto #cloud #IOT #computer #CISO #infosec #infosecurity #hacker #engineering"
2020-05-05,Tim_Herglotz,Six Strategies for Moving to the #Cloud | Link &gt;&gt; https://is.gd/pW0BSN . #cloudcomputing #cybersecurity #devops #security #Aws #Bigdata #Iot #Microsoft #Technology
2020-05-05,velez1066,"How often are factories under attack, and what kind of attacks do they suffer? Find out in @TrendMicro's upcoming #webinar, Real Threats and Security Strategies for Smart Factories. Register now: https://bit.ly/2KVLuah #IoT #IIoT"
2020-05-05,nTangledCloud,Contact tracing app 'fails' NHS and cyber security tests - http://Metro.co.uk https://buff.ly/2YBmm0K #tech #technology #blockchain #innovation #science #IT #BigData #Security #cybersecurity #crypto #cloud #IOT #computer #CISO #infosec #infosecurity #hacker #engineering
2020-05-05,software4iot,ZIGBEE SECURITY RESEARCH TOOL http://bit.ly/2Rrw6r8 #IoTSecurity #InternetOfThings #DigitalTransformation 0
2020-05-05,iotforall,Ignoring #Cybersecurity threats posed by insiders can be costly. Identifying early indicators can prevent attacks or at least limit their impact. || #IoTForAll #IoT #Infosec #CyberSec #Security @Threatpost
2020-05-05,nTangledCloud,"To Safely Reopen, Make the Workweek Shorter. Then Keep It Shorter. https://buff.ly/2YxvSC6 #tech #technology #blockchain #innovation #science #IT #BigData #Security #cybersecurity #crypto #cloud #IOT #computer #CISO #infosec #infosecurity #hacker #engineering"
2020-05-05,SftwreLogistics,Kudelski Group's Christopher Schouten | Security Challenges in the IoT Landscape https://bit.ly/3dmJ9kS #IoT
2020-05-05,cyberhayden,Calling all researchers for #IoT #security interested in up to a $100k bounty? Check out #Azure sphere so microcontroller powered devices can connect safely to the internet. Must be able to execute code on Pluton &amp; Secure World. Info on Azure Sphere https://docs.microsoft.com/en-us/azure-sphere/product-overview/what-is-azure-sphere#azure-sphere-architecture https://twitter.com/msftsecresponse/status/1257704064457924608
2020-05-05,NRG_fx,"Kaiji, a new Linux malware targets IoT devices in the wildSecurity Affairs #security #privacy #cloud"
2020-05-05,JsPadoan,New Kaiji malware targets IoT devices via SSH brute-force attacks #InternetOfThings #security 
2020-05-05,digital_trans4m,"Hardware Security Modules And Cyber Security Iot Market Future Growth by In Depth Industry Analysis, Size, Trends and Forecast to 2026 - Cole of Duty #IoT #Security CC:@Ronald_vanLoon https://coleofduty.com/military-news/2020/05/05/hardware-security-modules-and-cyber-security-iot-market-future-growth-by-in-depth-industry-analysis-size-trends-and-forecast-to-2026/"
2020-05-05,FoundriesIO,George Grey at #EmbeddedWorld 2020 demos how to use to containers with a legacy application. Work with #Foundries.io to make the process easier and quicker https://bit.ly/3b8J82K #FoundriesFactory #IoT #Edge #IIoT #Security #cybersecurity #Embedded #Linux #OTA #containers
2020-05-05,cybersecboardrm,"New Kaiji Botnet Targets IoT, Linux Devices #Cybersecurity #security #ux"
2020-05-05,melissablive,New Kaiji malware targets IoT devices via SSH brute-force attacks #InternetOfThings #security via http://twinybots.ch https://snip.ly/sodr3p
2020-05-05,Esperan12180084,Global Change: the first quarter of the new decade certainly has not disappointed. Would anyone have predicted where we are today? Here are the top ten things we have learned so far in 2020 #remoteworkers #IoT #security 
2020-05-05,TheIoT,Why you must prioritise security and convenience https://alltheinternetofthings.com/entries/650957 #IoT
2020-05-05,IntrinsicID,"Connectivity standards don't ensure security. See how Intrinsic ID delivers secure communications in the webinar ""Security for Cellular IoT: SIM Will Not Protect You!"" https://bit.ly/2A3e1sv #IoTsecurity #cellular #4G #5G #LoRa #SigFox #connectivity #SIM #cybersecurity"
2020-05-05,netforces,IoT Security: Need to Know 
2020-05-05,prolucid,Increasing #ransomware demands and the increasing likelihood they will be paid means we will continue to see increases in #CyberCrime. #CyberSecurity #Hackers #Malware #DataSecurity #DataProtection #IoTSecurity #CloudSecurity
2020-05-05,PhimixC,New Kaiji malware targets IoT devices via SSH brute-force attacks #InternetOfThings #security via http://twinybots.ch
2020-05-05,Techfuturenew,New Kaiji malware targets IoT devices via SSH brute-force attacks #InternetOfThings #security via http://twinybots.ch https://snip.ly/sodr3p
2020-05-05,prolucid,"@SolutionsReview outlines how privileged access management does more than provide authentication, overlapping with Data Loss Prevention (DLP), a critical endpoint security capability. #CyberSecurity #DataSecurity #DataProtection #IoTSecurity "
2020-05-05,SynergoGroup,The impact of IoT security for consumer devices 
2020-05-05,LooUQ,"In this episode of the IoT For All Podcast, Christopher Schouten of Kudelski Group shares IoT security considerations for new deployments, and how to ensure that your security measures scale. || #iotforall #iot #iotsecurity https://bit.ly/3b3HE9P via @iotforall"
2020-05-05,SMontigaud,"Global IoT Security Market, By Component, By Deployment, By Enterprise, By Security Type, By Application, By Region, Competition, Forecast &amp; Opportunities, 2025 "
2020-05-05,IoTofToday,Kudelski Group's Christopher Schouten | Security Challenges in the IoT Landscape | IoT for all https://bit.ly/2xH6bUI
2020-05-05,joseserranoB,Kudelski Group’s Christopher Schouten | Security Challenges in the IoT Landscape http://dlvr.it/RW3ry5
2020-05-05,SentinelOne,Webinar | What’s on your network? Leveraging SentinelOne #Ranger for #IoT discovery and control. https://assets.sentinelone.com/rangerweb #iotsecurity #cybersecurity
2020-05-05,shahid24x7,Privacy is a myth in this era. #Linux #Android #Windows #Facebook #Twitter #IoTSecurity #Pegasus #Malware #databreach #ArogyaSetuAppControvercy New Kaiji malware targets IoT devices via SSH brute-force attacks | ZDNet https://www.zdnet.com/article/new-kaiji-malware-targets-iot-devices-via-ssh-brute-force-attacks/
2020-05-05,jerinsantosh,"Kaiji, a new Linux malware targets IoT devices in the wild #UX #security via http://twinybots.ch"
2020-05-05,iotagenda,Learn how hackers create an #IoTBotnet and what steps to take to defend an #IoT deployment. https://bit.ly/2yypAY6 @Gartner_inc #Cybersecurity #IoTSecurity 
2020-05-05,ashishrbedekar,New Kaiji malware targets IoT devices via SSH brute-force attacks #InternetOfThings #security via http://twinybots.ch https://snip.ly/sodr3p
2020-05-05,FoundriesIO,Harnessing #AWS #Cloud can help manufacturers digitally transform to improve business operation @ManufacturingGL https://bit.ly/2zCsPOr #FoundriesFactory #container architecture allows you to quickly integrate with any IoT cloud #Foundries.io #security #Edge #IIOT #Industry4
2020-05-05,Zariot1,Why IoT fails? We Don’t Take Security Seriously Enough... read an interesting article via @iotforall
2020-05-05,mosaicsecurity,"AI, IoT, &amp; Mobile Security – The Week’s Best News – 2020.05.05 - Google Play has been spreading advanced Android malware for years (Ars Technica) https://mosaicsecurity.com/2020/05/05/ai-iot-mobile-security-the-weeks-best-news-2020-05-05/ #AI #mobilesecurity #IoT #cyber #infosec"
2020-05-05,Kudelski_IoT,Get a 30-minute download on key issues in IoT security from this IoT For All podcast with Kudelski IoT's Christopher Schouten. #podcast #iotsecurity 
2020-05-05,RayWitselHA,"Ding Dong, get to the door before they run away! #ditch #Security #IOT #SmartHome"
2020-05-05,SuriyaSubraman,Security alert: Suspected Chinese malware targets IoT devices http://dlvr.it/RW3nKS #iot #data #internetofthings
2020-05-05,liberobiz,New Kaiji malware targets IoT devices via SSH brute-force attacks #InternetOfThings #security via http://twinybots.ch
2020-05-05,ConnectedWMag,I can’t wait to kick off the month of May – this month I will be tackling #healthcare and #security. Join me and my first two guests now! https://peggysmedleyshow.com/ #TPSS #IoT #sustainability #AI #5G #cloud #edge #PeggySmedley #cybersecurity .@IAITAM .@CoachHavlik
2020-05-05,SECTORAdvisors,"Deal announcement: #Finite #State, a Columbus, Oh.-based supply chain and IoT security firm, raised $12.5 million in a Series A funding. Energy Impact Partners led the round, and was joined by investors including Zetta Venture Partners, and Niloofar Howe. #technology"
2020-05-05,IdrisOlasunka13,New Kaiji malware targets IoT devices via SSH brute-force attacks #InternetOfThings #security via http://twinybots.ch https://snip.ly/sodr3p
2020-05-05,Robotcybercrim1,Cross-Modal Leakage - IoT Devices - i-HLS - Israel Homeland Security https://ift.tt/2YEDQcy #IoT #internetofthings #cybersecurity
2020-05-05,opusinteractive,"We live in uncertain times, so stable energy costs and tight security are a must. How does Opus Interactive help you achieve this with our datacenters? https://opusinteractive.com/datacenters/ #datacenter #ITsecurity #IT #IoT #hybridcloud"
2020-05-05,jamesvgingerich,Ring Recommends Users Update Their Home #Security System Passwords After String of Hacking Incidents. (Time) #CyberSecurity #Privacy #IoT https://buff.ly/36zC3q5
