date,user_name,text
2020-05-07,Octopi_MS,"#Microsoft is putting up 100K for hackers to test the security of their #IOT platform ""#Azure Sphere"". A very progressive security approach for a platform (IOT) where many companies focus on ease of use vs security. #tech (via @happygeek )"
2020-05-07,asvin_iot,Our #cyberSecurity Talk about Security for smart cities starts now ! An exciting discussion awaits you. Do not miss anything and be part of it. Go to the livestream now : https://buff.ly/3bLpICc #SmartCities #SmartCities #IoT #IoTSecurity @mirko_ross
2020-05-07,5h15h,Microsoft announces $100k bounty (https://bit.ly/2SK2BAo) for exposing vulnerabilities in #AzureSphere https://bit.ly/2zmOgCU #IoT #AzureIoT #Security #Hackers
2020-05-07,Ihskasworld,#cybersecurity #hacking #security #technology #hacker #infosec #tech #ethicalhacking #programming #linux #hackers #cyber #kalilinux #cybercrime #malware #python #privacy #it #iot #cyberattack #coding #dataprotection #hack #ethicalhacker #networking #informationsecurity
2020-05-07,DaveMichels,"Things and People get secure! Microsoft to buy Israel-based CyberX, which develops security products for IoT and industrial systems. @Zoom_us to buy @KeybaseIO to enable e2e enterprise communications and collaboration."
2020-05-07,R3Coms,Read more here: https://hubs.ly/H0qgH6f0 #r3 #echoring #berlin #staysafe #industrialWireless #unwiringTheFuture #industry40 #reliablerealtimeradio #bebold #wireless #startup #jointherevolution #robots #wirelesscommunications #software #automation #iot #security 
2020-05-07,Rosaaaa,"Join @Wipro, @Microsoft @Azure and @DeviceAuthority to learn about IoT security for medical devices, security best practices to mitigate risks/threats, and real-world customer examples for protecting your IoT devices and data. https://hubs.ly/H0qg_tW0"
2020-05-07,DeviceAuthority,"Join our live session on May 20th: Ensuring operational resilience of Healthcare through effective IoT Security with @Wipro, @Microsoft @Azure and @DeviceAuthority https://hubs.ly/H0qgY3m0"
2020-05-07,darronantill,"Join our live session on May 20th: Ensuring operational resilience of Healthcare through effective IoT Security with @Wipro, @Microsoft and Device Authority https://hubs.ly/H0qgJSp0"
2020-05-07,prolucid,SAP notifying 9% of customers about security bugs in some cloud products. Details from @ZDNet #CyberSecurity #DataSecurity #DataProtection #CloudSecurity #IoTSecurity #ThreatDetection
2020-05-07,FirstDist,First Distribution is proud to announce our new division - Digital Security and IoT. The new Digital Security and IoT division will primarily focus on digital security and video surveillance solutions. Find out more about this exciting addition here. https://hubs.ly/H0qgx3q0
2020-05-07,aglongo,"Sources: Microsoft to buy Israel-based CyberX, which develops #security products for IoT and industrial systems, for $165M; CyberX has raised $48M to date (Ruti Levy/Haaretz) http://twib.in/l/BKMExrpqabyA #tech"
2020-05-07,ToyerToys,"Sources: Microsoft to buy Israel-based CyberX, which develops security products for IoT and industrial systems, for $165M; CyberX has raised $48M to date (Ruti Levy/Haaretz) http://dlvr.it/RWBSHz"
2020-05-07,vanuatutech,"Sources: Microsoft to buy Israel-based CyberX, which develops security products for IoT and industrial systems, for $165M; CyberX has raised $48M to date (Ruti Levy/Haaretz) https://bit.ly/3doridt #TechNews #TechTips"
2020-05-07,TechPats,"""Sources: Microsoft to buy Israel-based CyberX, which develops security products for IoT and industrial systems, for $165M; CyberX has raised $48M to date (Ruti Levy/Haaretz): Ruti Levy / Haaretz: Sources: Microsoft to buy Israel-based CyberX,… https://bit.ly/3fsHmNd #tech"
2020-05-07,Techmeme,"Sources: Microsoft to buy Israel-based CyberX, which develops security products for IoT and industrial systems, for $165M; CyberX has raised $48M to date (@ruti_l / Haaretz) https://www.haaretz.com/israel-news/business/.premium-microsoft-to-buy-israeli-cybersecurity-startup-cyberx-1.8823367 http://www.techmeme.com/200507/p20#a200507p20"
2020-05-07,neoceptual,"#Hyperautomation, #blockchain, #AI security, distributed cloud, and autonomous things drive disruption and create opportunities in this year’s strategic technology trends. @Gartner_inc #blockchain #AI #IoT #DigitalTransformation #Technology #Innovation #COVID19"
2020-05-07,AlisterBrenton,How to create a workflow for IoT software updates http://twib.in/l/59aLKbKpy9kB via @AlisterBrenton #security
2020-05-07,geekgrljez,Microsoft Nears $165M Deal For IoT Security Startup CyberX: Reports 
2020-05-07,Honest_Sec,HONEST Command gives you the confidence to securely fill your home with ALL the connected things. We are raising the bar for cyber security. From smart phones to smart homes. We are smart home cyber security. Learn more @http://command.honestsec.com #infosec #IoT #CyberSecurity
2020-05-07,SMontigaud,Microsoft Nears $165M Deal For IoT Security Startup CyberX: Reports https://buff.ly/2yyN9jy
2020-05-07,AVL_List,"Watch this on-demand webinar to learn more about AVL’s new IoT platform Device.CONNECT™, which provides instant data availability with the highest level of security. Download here: https://bddy.me/3c8xczc #datasecurity #IoT #autmotiveindustry #automotivesoftware"
2020-05-07,antgrasso,"Hyperautomation, blockchain, AI security, distributed cloud, and autonomous things drive disruption and create opportunities in this year’s strategic technology trends. Link &gt;&gt; https://gtnr.it/2KVuKQv @Gartner_inc via @antgrasso #blockchain #AI #IoT #DigitalTransformation"
2020-05-07,MElenaplacido,"According to the Microsoft Digital Crime Unit, a single botnet was responsible for as much as one terabyte of malicious content being released every week. #IoTinActionMS #IoT #Security "
2020-05-07,Shirley78547054,IoT devices that are beyond warranty or aren't being maintained should expire from networks automatically &amp; should be quarantined or removed from accessing the networks &amp; posing a security risk.
2020-05-07,SLesavich,How to Protect Your #SmartHome From #Hackers https://www.pcmag.com/how-to/how-to-protect-your-smart-home-from-hackers #PCMag #cybersecurity #security #privacy #IoT #IoTSecurity
2020-05-07,RayWitselHA,Did anyone else hear that? Time to go check the door. #Security #IOT #SmartHome
2020-05-07,Shirley78547054,@ITU @IEEEorg @FCC @NISTcyber @CISAgov @cyber @ETSI_STANDARDS @ietf @GOP @TheDemocrats @EU_Commission @EUCouncil @Ofcom IoT &amp; network devices including software should have lifetime security updates &amp; support.
2020-05-07,evanderburg,Privacy and Security in #IoT. @evanderburg interviewed at Dell IQT Day in New York http://i.securitytc.com/Vanderburg-IoT #cybersecurity #privacy
2020-05-07,nexusintegra,"In a scenario where most people are working from home, the remote access and management of devices and systems is crucial, but beware of the #security risks. @nexusintegra @Barbara_Iot the secure industrial #IoT combo #COVID19 #remotework"
2020-05-07,Shirley78547054,"Hacked devices should automatically be quarantined from networks & secure communication & credentials should be enforced with vulnerable IoT devices given firewall, IPS, antivirus &amp; update/security policy protection from cloud. Everything should be automatic &amp; not just alerts."
2020-05-07,AliceTurlington,Want to win $100K from Microsoft? Take part in our #AzureSphere Security Research Challenge for #IoT hackers! #cybersecurity https://lnkd.in/gWZUWN6 #MSFTAdvocate
2020-05-07,soc_naukri,Do you know? #hacking #security #technology #hacker #infosec #tech #ethicalhacking #cyber #socnaukri #cybercrime #malware #privacy #it #iot #cyberattack #coding #dataprotection #hack #ethicalhacker #networking #informationsecurity #cybersecurityawareness #datasecurity
2020-05-07,P12Neel,Future Growth and Analysis for #GreenTechnology and #Sustainability Increasing Awareness of Environmental Concerns and Growing Interest to Conserve Environment Through Integration of Technologies https://bit.ly/2yrxYcc #green #technology #security #IoT #AI
2020-05-07,LogZilla,WE'RE CALLING IT LIKE IT IS - https://bit.ly/2Kfrr6n - Log tool costs are out of control so how can you slice them by 50% in less than 30-seconds? LogZilla's Network Event Orchestrator - #SupplyChain #Security #5G #Data #BigData #DataAnalytics #AI #FinTech #EdTech #IIoT #IoT 
2020-05-07,FutureElec,Register now for #NXP's webinar on 13th May at 5:00 PM BST: Making Security and Performance Efficiencies Attainable For Your Cost-Conscious Industrial or IoT Application http://ow.ly/JuW450zzjEb
2020-05-07,jamesvgingerich,Common Challenges of Implementing a Single #IoT Security Standard. (Iot For All) https://buff.ly/32GmFqN
2020-05-07,wisdomplexus,Mind-reading #robots are no longer science fiction! #ArtificialIntelligence #NeuralNetworks #IoT #tech #futurism #Security #BigData @jamesvgingerich @anki @gtaank @BobViolino @KhalidHamdan0 @planetrobotics
2020-05-07,BearStoneHA,There are currently 70 clients on my network.#Security https://github.com/CCOSTAN/Home-AssistantConfig#networking #IOT #SmartHome
2020-05-07,iamrahulbasu,"Blockchain in IoT: A Vital Transformation: #Blockchain allows enterprises to manage data on edge devices in an #IoT system, reducing costs &amp; increasing security. #IoTBlockchain is now in its initial stages and will have a massive impact in the coming years"
2020-05-07,wattlecorp,Let’s Catch-up over a Cup of Security Gossips Registration link in comments . #wattlecorp #cybersecurity #cyber #meetup #webinars #free #freewebinar #covid19 #hacker #hack #malware #threathunting #iot #iotsecurity 
2020-05-07,bfbcping,Microsoft Shells Out $100K for IoT Security | #Security #IOT @iamthecavalry |
2020-05-07,bfbcping,Another Stuxnet-Style Vulnerability Found in Schneider Electric Software | #Security #IOT @iamthecavalry | https://www.securityweek.com/another-stuxnet-style-vulnerability-found-schneider-electric-software
2020-05-07,allot_ltd,"With #5G, it'll be imperative that all #IoT devices are protected from the network. @ifsecglobal demonstrates the need for all involved in the manufacture &amp; utilization of IoT devices to be aware of the potential pitfalls in poor cyber security standards&gt;&gt; "
2020-05-07,securityledger,Want the latest #security and #IoT news? Sign up for one of the securityledger newsletters or our weekly #podcast
2020-05-07,VBunyard,"IIoT technologies can leave transportation providers vulnerable to cyber attacks, but three steps can help them respond and recover. #IOT #security "
2020-05-07,cybeatstech,Detecting and Mitigating IoT Breaches Require An “Inside-out” Approach to Security #iot #cybersecurity #iomt
2020-05-07,newbharatdream,#Blog: WhatsApp Status &amp; Privacy https://link.medium.com/fA7Tc6XB95 . . . #privacy #security #cybersecurity #technology #dataprotection #tech #infosec #percent #dataprivacy #encryption #gdpr #data #hacking #datasecurity #hacker #databreach #digital #business #protection #cybercrime #iot
2020-05-07,AliAlexAli1234,#oil #gas #baghdad #government #basra #rosneft #lukoil #gazprom #chinatrade #oilandgas #refineries #putin #moscow #iotworld #iotsecurity #5gtechnology #5gnetworks #siemens #bri #silkroad #energy #norway #sweden #switzerland #saintpetersburg #iraqi
2020-05-07,victorrubiolh,"Two weeks ago, the #MSecProject consortium conducted remotely its 4th F2F meeting advancing on the co-design and development of a secure #IoT framework to cover main #security challenges in today’s IoT world. #CloudSecurity #DeviceSecurity #Blockchain"
2020-05-07,cybersecboardrm,"For 8 years, a hacker operated a massive IoT botnet just to download Anime videos #Cybersecurity #security "
2020-05-07,fontikos,Another warm thanks to @InfoSecDJ from @FSecure for his exciting Network Security seminar at @DTU_Compute on hacking embedded devices and IoT devices! 
2020-05-07,Helenzys,"Lets Pitch in data-driven IoT to achieve Tangible results. With only 31% of the companies calling themselves to be big data-driven, the peer companies are yet to get into the race. Website: https://helenzys.com/ #BigDataAnalytics #iot #bigdatamanagement #IoTSecurity #helenzys"
2020-05-07,linuxdevices,"With security baked in, iSIM is set to keep the IoT SAFE: Dave Weidner explains the importance of the new IoT SAFE standard in IoT security, and why iSIM is the form factor to get it there. The post With security baked in, iSIM is set to keep the IoT SAF… "
2020-05-07,AlisterBrenton,"For 8 years, a hacker operated a massive IoT botnet just to download Anime videos The botnet consisted solely of D-Link NAS and NVR devices and the botnet peaked at 10,000 bots in 2015. http://twib.in/l/oXjG4Kpjb87a via @AlisterBrenton #infosec #security "
2020-05-07,YoavDaniely,Want to win $100K from Microsoft? Take part in our #AzureSphere Security Research Challenge for #IoT hackers! 
2020-05-07,software4iot,Systems Architecture of Smart Home Security.. #embeddedsoftware #Software #IoT 
2020-05-07,BillMew,"#Govtech #security via @GovInfoSecurity: Kaiji Botnet Targets Linux Servers, IoT Devices https://qoo.ly/35uzsq @drjdrooghaag @fabriziobustama @antgrasso @sallyeaves @mikko @archonsec @yuhelenyu @1davidclarke"
2020-05-07,IAM__Network,Can Cloud Computing Skills Boost Your Job Security? READ MORE: https://blog.iammarketingmedia.com/can-cloud-computing-skills-boost-your-job-security/?utm_campaign=twitter&amp;utm_medium=twitter&amp;utm_source=twitter #AWS #Cloud #CloudComputing #Computers #Computing #DataScience #Future #Intranet #IoT #Microsoft
2020-05-07,Iubss,Top 10 Tech Skills in demand in 2019: 1. Machine Learning 2. Mobile Development 3. SEO/SEM Marketing 4. Data Visualization 5. Data Engineering 6. UI/UX Design 7. Cyber-security 8. Cloud Computing/AWS 9. Blockchain 10. IOT
2020-05-07,pebblebayembedd,'Six #IoTSecurity Threats to Watch' #embedded
2020-05-07,GlobalSign_NL,Tijdens de #COVID19 uitbraak zijn er veel hackers actief op drie specifieke gebieden: https://okt.to/jtwFYE Wees alert en houdt uw bedrijf en medewerkers online veilig: https://okt.to/xuUmKD #smime #EmailSecurity #DigitalSignatures #IoTsecurity #BYOD #authentication
2020-05-07,Allstream,"While SD-WAN improves the functioning of the IoT ecosystem, “SD-Branch extends the benefits of the secure SD-WAN’s security and control functions into the local network "
2020-05-07,ponceto91,"Microsoft offre jusqu'à 100 000 $à qui arrivera à pirater sa solution autour de l'IoT, Azure Sphere OS C'est dommage, pour ma part je ne tente rien en dessous de 1M$#Security #Hacking #bugbounty https://msrc-blog.microsoft.com/2020/05/05/azure-sphere-security-research-challenge/"
2020-05-07,FSsgray,"Next-Generation #911 to Cover Nearly 85% of the #US Population by 2025, says @Frost_Sullivan. Market participants can capitalize on the market by introducing platforms that integrate #IoT &amp; third-party #security systems (#telematics, gunshot detection):"
2020-05-07,UK_CIF,Next round of Zoom updates targets consumer security https://www.computerweekly.com/news/252482800/Next-round-of-Zoom-updates-targets-consumer-security #cloud #IOT 
2020-05-07,CARDCENTRIC,"Countless number of new technologies are a part of our daily lives every day which eases our lives by increasing productivity, comfort and security. Read more on http://en.cardcentric.com/card-centric-iot-in-daily-life/ #technology #security #IoT "
2020-05-07,EVRYTHNG,"With our Activate solution, you can now manage digitized products at scale: analytics dashboards, application and security management, #data integration and sharing w/ enterprise systems and blockchains. Learn more: https://hubs.ly/H0qgbT80 #IoT #tech #cloud #blockchain"
2020-05-07,MR_ANONWOLF,#CyberSecurity #Intelligence and #Analytics-Proceedings of the 2020 International Cyber Security Intelligence #Al #Ml #Books #Data #BigData #Java #JavaScript #ReactJS #Serverless #DataScientist #Linux #Programming #Coding #IoT #RStats . #DataScience here https://kickass.unblockall.org/torrent/3619312/freecourseweb-cyber-security-intelligence-and-analytics--proceedings-of-the-2020-international-conference-on-cyber-security-intelligen.html
2020-05-07,phas3two,"Microsoft chose Linux instead of Windows 10 to power an IoT security platform, and now it's offering hackers 100,000 US Dollars if they can break it. More Info on : https://alienskills.com/contents/MicrosoftOffers10000_1299992517957.html courtesy of 'The Geek App Reloaded By Alien Skills'"
2020-05-07,IAM__Network,RT Via: https://twitter.com/UnlockBiz RT fisher85m copy MikeQuindazzi antgrasso 10 #IoT #Security Targets Infographic #CyberSecurity #infosec #Industry40 #SmartCity #Healthcare #surveillance #Cloud #AutonomousVehicles [via
2020-05-07,sutevskid,"Innovations in business through the implementation of mobile and IoT devices are expanding, and equally so are the number of possible security threats. Can You Minimize Company Cyber Security Threats by Implementing an Employee Monitoring Software? https://buff.ly/36jN7Yq"
2020-05-07,Kleeblatt1977,"Webinare für Fernwartung, IoT und Industrial Security https://wissenschaft.pr-gateway.de/webinare-fuer-fernwartung-iot-und-industrial-security/"
2020-05-07,igent_io,Working on the edge: ensure safety with IoT and edge computing - Business Operations #iot #iiot #edgecomputing #security https://www.ibm.com/blogs/internet-of-things/iot-maximo-worker-insights/
2020-05-07,boccuzzillc,"Blockchain in IoT: A Vital Transformation: #Blockchain allows enterprises to manage data on edge devices in an #IoT system, reducing costs &amp; increasing security. #IoTBlockchain is now in its initial stages and will have a massive impact in the coming years"
2020-05-07,SecureIoTGuy,"Congratulations and thank you for your strong advocacy of #PSA to my friend @SecureRF and his team at Veridify Security, formerly SecureRF Corporation for achieving #psacertified for the Dome Client solution! #iotsecurity #cybersecurity"
2020-05-07,Layer8ltd,Remote Workers Failing on Password Security During #COVID19 Crisis #cybersecurity #hacking #security #technology #infosec #tech #malware #cybercrime #hackers #cyberattack #cybersecurityawareness #it #itsecurity #informationsecurity #iot #privacy
2020-05-07,RefirmLabs,Happy to help and support @IoTvillage. Looking forward to the event! #IoT #IoTSecurity #Hacking #firmware #reverseengineering #exploits #cyber #CyberSecurity #cyberattacks
2020-05-07,Humberto_Skalla,T makes it work. Reduce costs and increase efficiency - with digital solutions from IoT to cloud and security. Discover ways to optimize your business now. #BusinessContinuity #letspowerhigherperformance @Tsystemscom
2020-05-07,iotworldonline,Vulnerabilidades y consejos para proteger tu Internet de las Cosas https://as.com/meristation/2020/02/09/betech/1581285604_821481.html #IoT #InternetOfThings #InternetdelasCosas #IoTSecurity #Seguridad
2020-05-07,IoTNow_,Arm experts on how to stay ahead of the herd when it comes to device security https://buff.ly/35bbXdf #IoT #cybersecurity @Arm
2020-05-07,IoTNowTransport,Arm experts on how to stay ahead of the herd when it comes to device security https://buff.ly/35bbXdf #IoT #cybersecurity @Arm
2020-05-07,AntratekEurope,"These wireless sensors can be used up to 1 km away from a #gateway and the battery lasts more than a year. The new tabs range of #LoRaWAN products include motion, air quality, temperature, humidity and door #sensors. https://bit.ly/2YH4n93 . #tech #technology #IoTsecurity "
2020-05-07,Zariot1,A good podcast to listen concerning #IoTSecurity. #connectedprotected
2020-05-07,cpomagazine,#IoT security ratings might lead to a false sense of #security as ratings may no longer be valid as new vulnerabilities are discovered. #respectdata
2020-05-07,software4iot,MORFEUS - A FIELD-CONFIGURABLE WIDEBAND FREQUENCY CONVERTER AND SIGNAL GENERATOR http://bit.ly/2s3EPBw #IoTSecurity #IoT #DigitalTransformation 0
2020-05-07,smartest_home,Garage Door opened at 11:41. #homeautomation #IoT #security #smarthome
2020-05-07,ArkasLtd,First Distribution ramps up Digital Security and IoT – IT-Online http://www.arkas.co.uk/news
2020-05-07,seclabor,"#security :: For 8 years, a hacker operated a massive IoT botnet just to download Anime videos | ZDNet https://www.zdnet.com/article/for-8-years-a-hacker-operated-a-massive-iot-botnet-just-to-download-anime-videos/, see more http://tweetedtimes.com/seclabor?s=tnp"
2020-05-07,MindCommerce,#IoT #Microsoft #Security 
2020-05-07,igent_io,Kaiji IoT malware brute-forces Linux devices for DDoS attacks #iot #iiot #security https://www.hackread.com/kaiji-iot-malware-brute-forces-linux-devices-ddos-attacks/
2020-05-07,embedthat,"IoT Tip #5: Store passwords using suitable cryptographic hashes with high work-factors like ""bcrypt"" IoT Security Checklist: https://www.embedthis.com/blog/posts/stories/iot-developer-security-checklist.html Embedthis Software: https://www.embedthis.com/ #iot #embedded #cybersecurity #182"
2020-05-07,KedronUK,How has #COVID19 impacted the future of #IT #security? Here are the trends ExtraHop are seeing with #IoT and connected Devices. Download the Report and learn more about the risks impacting #enterprise Security moving forward. https://bit.ly/ExtraHopSecurityReport
2020-05-07,JinibaBD,"For 8 years, a hacker operated a massive IoT #botnet just to download Anime videos #CyberSec #Security #ThreatIntel #cybersecurity #dataprotection #cyberthreats #hackers #cybercrime #darkweb #digitalrisk #cyberintelligence #privacy #cyberattacks #IoT https://www.zdnet.com/article/for-8-years-a-hacker-operated-a-massive-iot-botnet-just-to-download-anime-videos/"
2020-05-07,ConfluxHQ,"#IoT Security Best Practices - @DZoneInc #refcard by Geoffrey Vaughn: ""new use cases and features bring new security considerations"" "
2020-05-07,ealloora,IoT POSSESS STRONG MONITORING FEATURE: TERMO . This asset allows you to monitor humidity and temperature in your house . Find yours in https://www.ealloora.com/en/termo/. #AlwaysConnectedWithTERMO #TERMO #ealloora #IoT #sigfox #plugandplay #lpwa #IoTSecurity #IoTProducts #IOST
2020-05-07,TeriRadichel,Microsoft Nears $165M Deal For IoT Security Startup CyberX: Reports [TR: Security for industrial control systems.] 
2020-05-07,LinuxSec,"#Security readings: For 8 years, a hacker operated a massive IoT botnet just to download Anime videos | ZDNet https://www.zdnet.com/article/for-8-years-a-hacker-operated-a-massive-iot-botnet-just-to-download-anime-videos/, see more http://tweetedtimes.com/LinuxSec?s=tnp"
2020-05-07,InVMA_IoT,Watch InVMA's series of Hidden Factory webinars. Choose a topic that interest you or watch all the webinars: #Industry4 #PredictiveMaintenance #AssetHealth #IoTSecurity #SmartFactory #IoTConnectivity #RemoteMonitoring #ConditionMonitoring https://zcu.io/gN0v
2020-05-07,JlGiboire,#IoT #Security @Software4iot #embeddedsoftware @LesFilles_Aussi #DataScience #Networks #Wearable #Industrie #InternetOfThings #TechNews https://infodsi.com/articles/184862/iot-comment-se-proteger-des-attaques-ddos.html
2020-05-07,sallybakhuizen,"MX routing and security are powerful together. You're investing in a next-gen network infrastructure that will meet the performance and scale requirements of 5G, IoT, and multicloud. http://jsod.so/1747A9"
2020-05-07,concordiah2020,"Solutions that provide strong countermeasures are required in order to protect #IoT / Embedded systems. In CONCORDIA, we want to provide one of such solutions – a #Hardware Security Token Learn more in our blog post! https://www.concordia-h2020.eu/blog-post/enhancing-hardware-security-in-iot-embedded-systems/ #SecurityByDesign #cybersecurity"
2020-05-07,igent_io,LED and Buzzer for General Purpose and Security - All The Internet Of Things #iot #iiot #security https://alltheinternetofthings.com/entries/650974
2020-05-07,Buddahfan,Microsoft Shells Out $100K for IoT Security: https://threatpost.com/microsoft-100k-iot-security-azure-sphere/155517/ via @threatpost
2020-05-07,HFerrouillat,"Blockchain in IoT: A Vital Transformation: #Blockchain allows enterprises to manage data on edge devices in an #IoT system, reducing costs &amp; increasing security. #IoTBlockchain is now in its initial stages and will have a massive impact in the coming years"
2020-05-07,iotworldonline,Los dispositivos de IoT no autorizados ponen contra las cuerdas a las empresas https://www.silicon.es/los-dispositivos-de-iot-no-autorizados-ponen-contra-las-cuerdas-a-las-empresas-2414144/ #IoT #InternetdelasCosas #InternetOfThings #IoTSecurity #Seguridad
2020-05-07,software4iot,WHID - AN USB RUBBERDUCKY http://bit.ly/2RuVfBc #IoTSecurity #InternetOfThings #TechNews 0
2020-05-07,Ihskasworld,#cybersecurity #hacking #security #technology #hacker #infosec #tech #ethicalhacking #programming #linux #hackers #cyber #kalilinux #cybercrime #malware #python #privacy #it #iot… https://www.instagram.com/p/B_4Xe5jA-xg/?igshid=3svtz6fcatxk
2020-05-07,asvin_iot,"Today our expert talk about ""Security for smart"" cities will take place via live stream. Be there from 17:00 CET and join the discussion ! Here you get directly to the YouTube live stream : https://buff.ly/3bLpICc @mirko_ross #cybersecurity #IoTSecurity @IoTCrawler #IoT "
2020-05-07,SyedSharukh,ExtraHop Report Shows Shifts In IoT Device Usage During COVID-19 | Security News - SecurityInformed http://dlvr.it/RW9TWb
2020-05-07,ComsolIot,"Keep tabs on the go, anywhere, all the time with our Object Locator. #comsol #comsoliot #iot #objectlocator #smarttracking #iotdevices #essentialservices #iotsolutions #iotsecurity #iotdevelopment #smartsecurity"
